{
  "$schema": "https://json-schema.org/draft/2020-12/schema",
  "title": "fingerprint",
  "description": "What novelty rules compare against. One per published or approved video.",
  "type": "object",
  "required": [
    "id",
    "channel",
    "date",
    "topic_text",
    "primitives",
    "opening",
    "theme",
    "hook_pattern"
  ],
  "additionalProperties": false,
  "properties": {
    "id": {
      "type": "string",
      "minLength": 1
    },
    "channel": {
      "enum": [
        "c1-automation",
        "c2-reach",
        "c3-studio"
      ]
    },
    "date": {
      "type": "string",
      "format": "date"
    },
    "topic_text": {
      "type": "string",
      "minLength": 1
    },
    "primitives": {
      "type": "array",
      "items": {
        "enum": [
          "word-stack-slam",
          "highlighter-swipe",
          "pile-drop",
          "counter-drop",
          "flow-build",
          "flow-run",
          "conveyor",
          "chat-pop",
          "stamp-hit",
          "host-hook",
          "ui-inbox",
          "ui-sheet",
          "ui-chat",
          "ui-diff",
          "host-payoff",
          "host-cta",
          "end-card",
          "split-flap",
          "before-after-split",
          "phone-buzz",
          "maze-to-line",
          "zoom-dive",
          "rpg-panel",
          "point-cloud",
          "line-draw",
          "intertitle"
        ]
      },
      "minItems": 1
    },
    "opening": {
      "enum": [
        "word-stack-slam",
        "highlighter-swipe",
        "pile-drop",
        "counter-drop",
        "flow-build",
        "flow-run",
        "conveyor",
        "chat-pop",
        "stamp-hit",
        "host-hook",
        "ui-inbox",
        "ui-sheet",
        "ui-chat",
        "ui-diff",
        "host-payoff",
        "host-cta",
        "end-card",
        "split-flap",
        "before-after-split",
        "phone-buzz",
        "maze-to-line",
        "zoom-dive",
        "rpg-panel",
        "point-cloud",
        "line-draw",
        "intertitle"
      ]
    },
    "hero_metaphor": {
      "type": "string"
    },
    "theme": {
      "enum": [
        "paper",
        "ink",
        "mono",
        "studio",
        "night",
        "archive",
        "night-signal",
        "archive-gold"
      ]
    },
    "hook_pattern": {
      "enum": [
        "pile",
        "should-not",
        "question",
        "number",
        "confession",
        "myth",
        "before-after"
      ]
    },
    "caption_opener": {
      "type": "string"
    },
    "hash": {
      "type": "string"
    },
    "style": {
      "type": "string",
      "pattern": "^c[0-9]-[a-z0-9-]+-v[0-9]+$",
      "description": "the style preset the video was rendered in (Learn scores each version)"
    },
    "cta": {
      "type": "string",
      "minLength": 1,
      "description": "the closing card's CTA text (Learn scores CTAs)"
    },
    "seconds": {
      "type": "number",
      "minimum": 1,
      "description": "the rendered length (Learn scores lengths)"
    }
  }
}
